{
  "$schema": "./project-report.config.schema.json",
  "schemaVersion": 1,
  "catalog": {
    "id": "website-qa-baseline",
    "version": "1.0.0"
  },
  "project": {
    "name": "Beispielwebsite",
    "preferredUrl": "https://example.com/",
    "evaluationEnvironment": "production",
    "sourceRevision": "PROJEKT-COMMIT",
    "deploymentId": "DEPLOYMENT-ARTEFAKT"
  },
  "selectedModules": [
    "core",
    "auftrag-recht-uebergabe"
  ],
  "evidenceFile": "./project-evidence.example.json",
  "technicalRuns": [
    {
      "reportFile": "./http-report.example.json",
      "targetUrl": "https://example.com/",
      "environment": "production",
      "command": "website-qa-http https://example.com/ --strict --json",
      "sourceRevision": "PROJEKT-COMMIT",
      "deploymentId": "DEPLOYMENT-ARTEFAKT"
    },
    {
      "reportFile": "./crawl-report.example.json",
      "targetUrl": "https://example.com/",
      "environment": "production",
      "command": "website-qa-crawl https://example.com/ --sitemap --max-pages=50 --max-resources=500 --strict --json",
      "sourceRevision": "PROJEKT-COMMIT",
      "deploymentId": "DEPLOYMENT-ARTEFAKT"
    },
    {
      "reportFile": "./browser-report.example.json",
      "targetUrl": "https://example.com/",
      "environment": "production",
      "command": "website-qa-browser https://example.com/ --max-pages=10 --max-requests=300 --strict --json",
      "sourceRevision": "PROJEKT-COMMIT",
      "deploymentId": "DEPLOYMENT-ARTEFAKT"
    },
    {
      "reportFile": "./social-report.example.json",
      "targetUrl": "https://example.com/",
      "environment": "production",
      "command": "website-qa-social https://example.com/ --sitemap --max-pages=20 --strict --json",
      "sourceRevision": "PROJEKT-COMMIT",
      "deploymentId": "DEPLOYMENT-ARTEFAKT"
    }
  ],
  "itemStates": [
    {
      "itemId": "CORE-DOM-04",
      "status": "external",
      "recordedAt": "2026-08-24",
      "recordedBy": "technisch verantwortliche Stelle",
      "note": "Der Nachweis zur automatischen Zertifikatserneuerung liegt beim Hostinganbieter.",
      "responsible": "Hostinganbieter"
    }
  ]
}
